朝;チョウ;あさ;あ, あそ, ささ, ちか, とも;morning, dynasty, regime, epoch, period, (North) Korea;十: ten<br>早: early, fast<br>肉: meat;月;つき・つきへん;(none);会意 Compound Ideographic;morning;There is mist as the moon fades away in the morning.;"Morning has come ""ten"" hours ""early""!!! The ""moon"" is still in the sky!"
昼;チュウ;ひる;;daytime, noon;尺: shaku, Japanese foot, measure, scale, rule<br>旦: daybreak, dawn, morning;日;ひ・ひへん・にち・にちへん;晝;会意 Compound Ideographic;daytime;Roosters in Japan are very civilised, they play the shakuhachi at nightbreak to signify the beginning of daytime.;In a Zelda game, you can warp to the daytime if you play your shakuhachi to bring about nightbreak... or your ocarina if you don´t have a shakuhachi.
夜;ヤ;よ、よる;;night, evening;亠: kettle lid radical (no. 8)<br>人: person<br>夕: evening;夕;ゆう・ゆうべ・た;(none);会意 Compound Ideographic;night;"Actually, the lower-right primitive isn´t quite ""walking legs."" It´s a little more like ""evening"" with an extra stroke across it (look up the stroke order). So, it helps me to see this kanji for night as: evening plus an extra stroke representing the tuxedo tails to match the top hat which my special person is wearing out on the town...";Here we have Mister T sleepwalking, wearing a top hat as if he was the ambassador of the night, walking, and walking and walking on his tired walking legs, until he drops (back into his bed).
分;ブン、フン、ブ;わ.ける、わ.け、わ.かれる、わ.かる、わ.かつ;いた, わけ;part, minute of time, segment, share, degree, one's lot, duty, understand, know, rate, 1%, chances, shaku/10;八: eight, eight radical (no. 12)<br>刀: sword, saber, knife;刀;かたな・りっとう;(none);会意 Compound Ideographic;part;When something is entered by a dagger, it ends up being cut in several parts.;"(This kanji also has the meanings of ""understand"" and ""minute""). It´s important to understand that were you to enter an hour with a dagger and cut it into parts, those parts would be minutes."
週;シュウ;;;week;周: circumference, circuit, lap<br>辶: walk, walking, road radical variant (no. 162);辵;しんにょう・しんにゅう;(none);形声 Phonetic;week;Imagine a road built so well that it takes only a week to travel the circumference of the earth.;Actually the week is like a never ending road where we travel in a circle through the same seven days again and again, the circumference is always the same. circumference (#317) also means circuit or lap, so that also makes think about the rotations of the moon, sun and the earth -- all important for measuring all kinds of time periods.
春;シュン;はる;あずま, かす, すの, ひ, わら;springtime, spring (season);三: three<br>大: large, big<br>日: day, sun, Japan, counter for days;日;ひ・ひへん・にち・にちへん;(none);形声 Phonetic;springtime;In the springtime bonsai get plenty of sun.;When it´s springtime you can only leave the bonsai out when the sun has gone down. Their little leaves can´t handle too much heat.
夏;カ、ガ、ゲ;なつ;;summer;一: one, one radical (no.1)<br>自: oneself<br>夂: winter radical (no. 34);夊;なつあし・すいにょう;(none);象形 Pictographic;summer;In SUMMER you are hot from the top of your head down to your walking legs.;I personally think it was too confusing to try and use head as the primitive. (How am I supposed to remember that the animal legs are replaced with walking legs instead of human legs?) Rather, I think have the image of a hot summer and you want to keep oneself under a ceiling not out jogging around.
秋;シュウ;あき、とき;あい;autumn;禾: 2-branch tree radical (no. 115)<br>火: fire;禾;のぎ・のぎへん;(none);会意 Compound Ideographic;autumn;In AUTUMN, the WHEAT looks the color of FIRE, meaning it´s time to harvest it.;Every autumn the wheat is set on fire to clear the way for next year´s crop...
冬;トウ;ふゆ;;winter;夂: winter radical (no. 34)<br>冫: two-stroke water radical or ice radical (no. 15);冫;にすい;(none);象形 Pictographic;winter;Don´t slip off your legs in winter, strap two skis to your feet.;In winter my walking legs feel like blocks of ice.
今;コン、キン;いま;な;now;人: person<br>一: one, one radical (no.1);人;ひと・にんべん・ひとやね;(none);仮借 Loan;now;My MEETING is at 7- but that´s NOW!;(re: ruuku35) The meeting is not at quarter to seven but now!
新;シン;あたら.しい、あら.た、あら-、にい-;あせ, あたらし, し, に, にっ, につ, よし;new;立: stand up, rise, set up, erect<br>木: tree, wood<br>斤: axe, 1.32 lb, catty, counter for loaves of bread, axe radical (no. 69);斤;おの・おのづくり・きん;(none);会意 Compound Ideographic;new;Don't confuse left primitive with catalpa (#1498). Every time the farmer cuts down the peppers from the red pepper plant, he has to use a brand new axe. This is because the spicy peppers cause the metal to erode very quickly, thereby rendering the axe completely useless.;Axe-man grows a patch of red pepper plants in his back garden. He rubs red peppers on the edge of his axes, and this seems to keep them sharp like brand new.
古;コ;ふる.い、ふる-、-ふる.す;ふゆ;old;十: ten<br>口: mouth;口;くち・くちへん;(none);会意 Compound Ideographic;old;Tombstone and cross on an old man´s grave.;You get OLD fast if you have ten open mouths to feed.
間;カン、ケン;あいだ、ま、あい;ちか, は, はざ, はし;interval, space;門: gate, counter for cannons<br>日: day, sun, Japan, counter for days;門;もん・もんがまえ・かどがまえ;(none);会意 Compound Ideographic;interval;The interval between star systems (suns) was too large, so the stargates were created to travel between them.;We open the gates at regular intervals to let a bit of sun in.
方;ホウ;かた、-かた、-がた;から, な, なた, ふさ, まさ, みち, も, わ;direction, person, alternative;亠: kettle lid radical (no. 8);方;ほう・ほうへん・かた・かたへん;(none);象形 Pictographic;direction;Note: The primitives are top hat and bound up. Compare ten thousand (#64). Story: A rich man wearing a top hat and bound up from head to toe hobbles up to you and asks for directions to the nearest police station because he just escaped from his kidnappers.;I always keep my directions bound to the bottom of my top hat so I won´t lose them.
北;ホク;きた;きら, ほう, ほっ, ほつ;north;匕: spoon, spoon or katakana hi radical (no. 21);匕;さじ・さじのひ・さじづくり・ひ;(none);会意 Compound Ideographic;north;Warning: The left part is NOT the primitive turtle! The stroke order is different. Sometimes it will look exactly the same but not always depending on the font / style used to draw this character. Be sure to study the difference!;In the north, the weather is so cold that people are often seen sitting back to back to preserve warmth.
南;ナン、ナ;みなみ;なみ, は, みな, みまみ;south;十: ten<br>冂: upside-down box radical (no. 13)<br>干: dry, parch;十;じゅう・じゅうへん;(none);象形 Pictographic;south;South of my belt leads to happiness.;"In the south (Southern Alabama, Southern Africa, picture any south, but choose one and stick with it) ""they measure happyness by the belt"". If someone has a larger belly (and a longer belt), it is believed they are well fed and thus are happy."
東;トウ;ひがし;あい, あがり, あずま, あづま, こ, さき, しの, とお, はる, ひが, もと;east;木: tree, wood<br>日: day, sun, Japan, counter for days;木;き・きへん;(none);仮借 Loan;east;Traditionally seen as a pictograph of the sun rising behind a tree.;The sun pierces through the trees as it rises in the east…
西;セイ、サイ、ス;にし;いり, ひし, むら;west, Spain;襾: west, west radical (no. 146);襾;にし・かなめのかしら・おおいかんむり;(none);仮借 Loan;west;The old west represented by a completely empty whiskey bottle (compare sign of the bird (#1427) whiskey bottle about one third full).;Note: this kanji is also used to denote Spain.
遠;エン、オン;とお.い;お, おに, ど, どお;distant, far;袁: long kimono<br>辶: walk, walking, road radical variant (no. 162);辵;しんにょう・しんにゅう;(none);形声 Phonetic;distant;Keep distant from a lidded crock on the road wrapped in a scarf. It might be a bomb.;When traveling to a distant land, what better way of keeping warm on the road is there than carrying a warm lidded crock and wearing a scarf?
近;キン、コン;ちか.い;おう, おお, この;near, early, akin, tantamount;斤: axe, 1.32 lb, catty, counter for loaves of bread, axe radical (no. 69)<br>辶: walk, walking, road radical variant (no. 162);辵;しんにょう・しんにゅう;(none);形声 Phonetic;near;The end is near. The axe-murderer is waiting for you on the road...;An absurd image, but working for me: two points A and B are separated by a long road. To make A and B near, take an ax, cut a big chunk of road, and the work is done.
前;ゼン;まえ、-まえ;さき, さと, まい;in front, before;八: eight, eight radical (no. 12)<br>月: month, moon<br>刀: sword, saber, knife;刀;かたな・りっとう;(none);会意 Compound Ideographic;in front;When I get horny my flesh sword sticks out in front of me.;If you stand in front of a bull´s horns, you are asking for your flesh to be cut (or butchered if you prefer).
後;ゴ、コウ;のち、うし.ろ、うしろ、あと、おく.れる;こし, し, しい, しり;behind, back, later;彳: stop, linger, loiter, going man radical (no. 60)<br>幺: short thread radical (no. 52)<br>夂: winter radical (no. 34);彳;ぎょうにんべん;(none);会意 Compound Ideographic;behind;Column of walking legs (caterpillar) getting into a cocoon, about to leave its past self behind.;after a grub goes through the cocoon stage, it leaves its walking legs behind for a life of flight.
内;ナイ、ダイ;うち;いと, ただ, ち, のち;inside, within, between, among, house, home;冂: upside-down box radical (no. 13)<br>人: person;入;いる・にゅう・いりがしら・いりやね;(none);象形 Pictographic;inside;Mr. T´s new belt is huge! When he´s inside it, his feet no longer touch the ground!;How is a person ever supposed to get inside that girl when she´s wearing such a huge chastity belt? I guess that´s kinda the point, eh?
外;ガイ、ゲ;そと、ほか、はず.す、はず.れる、と-;うい, け, ふか;outside;夕: evening<br>卜: divination;夕;ゆう・ゆうべ・た;(none);会意 Compound Ideographic;outside;A young magician likes to practice outside in the evening with his magic wand (as opposed to the old magician who wakes early to practice with his wand in eminent (#51)).;Outside in the dark of evening, only a magic wand can help you.
場;ジョウ、チョウ;ば;;location, place;土: soil, earth, ground, Turkey<br>昜: open, sun;土;つち・つちへん・どへん;(none);形声 Phonetic;location;You´re looking for a good location to bury your piggy bank savings. It has to be in some soft soil that´s easy to dig up, well hidden, and easy to remember like this kanji.;Don´t confuse with place (#1127). Think of location not as a single fixed spot, but as the act of locating. You´ve buried your piggy bank in the dirt in your backyard, but you can´t remember where. You frantically dig everywhere in a process of location to find your piggy bank.
地;チ、ジ;;どま;ground, earth;土: soil, earth, ground, Turkey<br>也: to be (classical);土;つち・つちへん・どへん;(none);形声 Phonetic;ground;Picture the ground as an extent of soil where scorpions are buried like land mines. Imagine a sign post saying ´no trespassing, scorpion mines´ if that helps, and how it is dangerous to walk there.;The soil is littered with scorpions everywhere and no ones dares put their foot on the ground.
国;コク;くに;くな, こ;country;囗: box or enclosure radical (no. 31), box<br>玉: jewel, ball;囗;くに・くにがまえ;國;会意 Compound Ideographic;country;In my country (England) the crown jewels are kept pent-in in the Tower of London. Which happens to be where enemies of the state were once also pent-in (probably for trying to steal those jewels).;Just think of Japan, a country which is like a jewel but historically very enclosed.
園;エン;その;おん, ぞの;park, garden, yard, farm;囗: box or enclosure radical (no. 31), box<br>袁: long kimono;囗;くに・くにがまえ;(none);形声 Phonetic;park;A nice picnic pent up in the park, with your crock pot and scarf (picnic blanket).;There was a homeless man living in a box at the park so I gave him a lidded crock filled with hot curry tied with a scarf...
谷;コク;たに、きわ.まる;がい, がえ, がや, せ, たり, たん, や;valley;口: mouth;谷;たに・たにへん;(none);象形 Pictographic;valley;This could be seen as a very accurate pictograph of another type of valley: a valley mouth open under the umbrella of inner labia, with the outer labia parted above. There are even more connections to be made among the primitive keywords and the visuals, but i will enter no further...;Think of the classic anime 風の谷のナウシカ (Nausicaa of the Valley of the Wind). We see Nausicaa entering the valley mouth gliding on an umbrella.
野;ヤ、ショ;の、の-;ずけ, つけ, ぬ;plains, field, rustic, civilian life;里: ri, village, parent's home, league<br>予: beforehand, previous, myself, I;里;さと・さとへん;(none);形声 Phonetic;plains;These days we all work in front of computers. Beforehand we all worked out in the fields, in the plains.;The plains are a challenging place to get any work done. Be sure you recharge your computer´s battery beforehand, or you won´t get anything done.
原;ゲン;はら;た, ばる, ら, わた, わら;meadow, original, primitive, field, plain, prairie, tundra, wilderness;厂: wild goose, trailing cliff radical (no. 27)<br>白: white<br>小: little, small;厂;がんだれ;(none);象形 Pictographic;meadow;Follow the springs down the cliff and you will find a nice meadow.;Sorry about this, but Heisig was stupid calling this kanji meadow, used in composite words the most common meaning is ORIGIN... To remember just think that life may have begun in pounds or springs in a land with many cliffs ... Just to answer correctly the review lessons think of meadow as the origin of a huge forest.
