村;ソン;むら;え, むた, ら;town, village;木: tree, wood<br>寸: measurement, foot/10;木;き・きへん;(none);形声 Phonetic;town;If you´ve ever played an old 8 bit or 16 bit RPG, like Dragon Warrior or Final Fantasy or Inindou, you´ll remember that every town was all bordered off by a line of trees with no space in between to get out through. Imagine that the trees were glued together so you could only exit town through the main or side gates, (so you couldn´t escape the important scripted scenes.).;Pfft. At it´s core, a town is just a bunch of wood glued together. Edit - Stop starring this piece of crap story! xD.
町;チョウ;まち;;village, town, block, street;田: rice field, rice paddy<br>丁: street, ward, town, counter for guns, tools, leaves or cakes of something, even number, 4th calendar sign;田;た・たへん;(none);形声 Phonetic;village;Actually this means town, like one that has lots of streets and is surrounded by all the rice fields.;"Getting this one confused with Town is easy, so remember it with this rhyme. ""Pillage the village, for the rice and and the tea."" the street primitive on the right looks like a ´t´."
森;シン;もり;もと;forest, woods;木: tree, wood<br>林: grove, forest;木;き・きへん;(none);会意 Compound Ideographic;forest;The higher you go up a mountain the less trees there are, that´s so u dont mess up with their possition like i do.;Another tree planted within a grove turns it into a FOREST.
正;セイ、ショウ;ただ.しい、ただ.す、まさ、まさ.に;おお, くに, ま, まさし, ただし;correct, justice, righteous, 10**40;一: one, one radical (no.1)<br>止: stop, halt;止;とまる・とめる・とめへん;(none);会意 Compound Ideographic;correct;If you do it correct on the first attempt you can stop.;The correct way of learning Japanese? First, stop everything you´re doing. Then, go pick up a copy of Heisig´s book and work from there.
水;スイ;みず、みず-;うず, ずみ, つ, ど, み, みさ, みつ, みな, みん;water;水: water, water radical (no. 85);水;みず・したみず・さんずい;(none);象形 Pictographic;water;The kanji for water is an abstract primitive itself, so unless one is willing to break down its etymological development, it should just simply be memorized by strokes, constructing a story is not necessarily useful unless it strongly denotes its shape (I find that Heisig´s story doesn´t do this).;"For those having issues with this* ""A 7K foot pool of water"" Notice it looks like a 7, and a K. Might have to practice writing it a few times."
火;カ;ひ、-び、ほ-;;fire;火: fire, fire radical (no. 86);火;ひ・ひへん・れっか・れんが;(none);象形 Pictographic;fire;For some reason, this kanji reminds me of a person running, her arms (the two drops) raised up, because she caught on fire!;A tepee getting shot at by fire arrows.
玉;ギョク;たま、たま-、-だま;おう, だん;jewel, ball;玉: jewel, ball<br>丶: dot, tick or dot radical (no. 3);玉;たま・たまへん ・ おう・おうへん・あうさま;(none);象形 Pictographic;jewel;The king is said to have only one family jewel below the belt...;"The king is said to have only one family jewel below the belt...and he hangs left! (I always screw up the direction of the ""drop"")."
王;オウ、-ノウ;;おお, おおきみ, わ;king, rule, magnate;玉: jewel, ball;玉;たま・たまへん ・ おう・おうへん・あうさま;(none);象形 Pictographic;king;To be king you have to be a real crafty one !;The king unites heaven and earth. (imagine heaven being the top line over the soil).
石;セキ、シャク、コク;いし;いさ, いす, いわ, し, せっく, と;stone;口: mouth;石;いし・いしへん;(none);会意 Compound Ideographic;stone;Indiana Jones jumps up and grabs the lip of cliff just in time to evade the huge STONE rolling out of the mouth of the cave!;There´s a VERY simple way to remember this, in case the cliff thing isn´t working for you... Just see it as a stone [いし] being hammered by a miner searching for jewel stones [ほうせき] ,).
竹;チク;たけ;たか;bamboo;竹: bamboo, bamboo radical (no. 118);竹;たけ・たけかんむり;(none);象形 Pictographic;bamboo;Pandas like to eat bamboo. I´m using panda as the primitive name when it fits the story. ^__^.;Two reclining victims impaled on bamboo spheres...
糸;シ;いと;;thread;糸: thread, string, thread radical (no. 120);糸;いと・いとへん;絲;会意 Compound Ideographic;thread;I also went with Spiderman. However, in the cases where this primitive appears under other primitives, as opposed to on the left (I think there are ~5 times in this chapter) I´ve opted to use a similar character: Venom. This helps keep the positioning clear, especially on such characters as dainty (#1363) and accumulate (#1364).;You´ll be seeing this one a lot. Seriously.
貝;バイ;かい;;shellfish;目: eye, class, look, insight, experience, care, favor;貝;かい・かいへん・こがい;(none);象形 Pictographic;shellfish;Eye thought I saw a shellfish legging it down the beach!;Stare at the shellfish, it looks like an eye with legs.
車;シャ;くるま;くら, くろま;car;車: cart, car, car radical (no. 159);車;くるま・くるまへん;(none);象形 Pictographic;car;My car is so fast it can go through ten rice fields in ten minutes.;"Rather than hobbling along with a walking stick to cross through a span, it´s much better to use a car. (Imagine an old man with a walking stick creeping along a span of road, and you, in a car, whizzing right by him. It´s funny ´cause it´s true.) Also, it´s important to include the word ""through,"" so you know the walking stick goes right THROUGH the span."
金;キン、コン、ゴン;かね、かな-、-がね;かん, きむ, こ, この, ん;gold;金: metal, gold,  gold radical (no. 167);金;かね・かねへん;(none);象形 Pictographic;gold;The fat king taking up the whole space under the umbrella actually isn´t fat - he just has two big gold bars hidden under his clothes.;"Under the umbrella´s shade, the king sang, "" Drop it to the left, drop it to the right, give me all the GOLD in sight!""."
雨;ウ;あめ、あま-、-さめ;;rain;雨: rain, rain radical (no. 173);雨;あめ・あめかんむり・あまかんむり;(none);象形 Pictographic;rain;From the ceiling hangs a towel dripping four drops like RAIN.;Towel hung out on a line to ....oops, it´s rain.
赤;セキ、シャク;あか、あか-、あか.い、あか.らむ、あか.らめる;あ, あこ, あま;red;土: soil, earth, ground, Turkey;赤;あか・あかへん;(none);会意 Compound Ideographic;red;He was stabbed with a dagger, and little drops of red blood dropped onto the ground.;There was red all over the soil after Little Red Riding Hood plunged a dagger into the wolf. Those two dots we see are wolfies animal legs we see, by the way (a la smithsonian).
青;セイ、ショウ;あお、あお-、あお.い;お;blue, green;月: month, moon;青;あお・あおへん;(none);形声 Phonetic;blue;The last time I saw a blue moon was in my youth when I was growing up.;"Once in a blue moon refers to a rare event. But originally ""blue moon"" refers to a full moon, in other words a fully grown-up moon. Whether once a month is rare or not depends on what we´re talking about, but that happens to be the origin of the expression."
白;ハク、ビャク;しろ、しら-、しろ.い;あき, か, はっ;white;日: day, sun, Japan, counter for days;白;しろ・しろへん;(none);象形 Pictographic;white;A white ray is a drop of sun.;Even a small drop (´) of the sun (日) would make you see nothing but white.
数;スウ、ス、サク、ソク、シュ;かず、かぞ.える、しばしば、せ.める、わずらわ.しい;じゅ;number, strength, fate, law, figures;米: rice, USA, metre<br>女: woman, female<br>攵: strike, hit, folding chair radical variant (no. 66);攴;ぼくにょう・ぼくづくり・とまた・のぶん・しぶん;數;会意 Compound Ideographic;number;"Young taskmaster is learning numbers by watching women haul sacks of rice past him. ""One... two... four! No, wrong! Go back, go back!"".";Women toil in the rice fields carrying heavy sacks of rice to be numbered and counted by the taskmaster.
多;タ;おお.い、まさ.に、まさ.る;;many, frequent, much;夕: evening<br>夕: evening;夕;ゆう・ゆうべ・た;(none);会意 Compound Ideographic;many;Two evenings too many!;"This reminds me of a childish pseudo-confucion rhyme: ""He who eats many prunes sits on toilet many moons""."
少;ショウ;すく.ない、すこ.し;;few, little;小: little, small<br>丿: katakana no radical (no. 4);小;しょう・ちいさい・なおがしら・つ;(none);象形 Pictographic;few;Only a few people can make an ugly face like that.;Few usually refers to three. To emphasize three, we underline the three drops in little.
万;マン、バン;よろず;かず, ま, ゆる;ten thousand;一: one, one radical (no.1);艸;くさ・くさかんむり;萬;象形 Pictographic;ten thousand;I bound ten thousand dollars together and hid it under the floor.;"We have ""one"" at the top and if you turn the kanji 90 degrees you will see arabic 4 shich means it has four zeros in front of it!"
半;ハン;なか.ば;は;half, middle, odd number, semi-, part-;丶: dot, tick or dot radical (no. 3)<br>二: two, two radical (no.2)<br>十: ten;十;じゅう・じゅうへん;(none);象形 Pictographic;half;"Imagine karate chopping the number three in half with a WALKING STICK and pausing the picture just as the first ""board"" breaks.";I think of this as a pictograph, there are three boards to cut, the first one is already in half and there are still two more to go.
形;ケイ、ギョウ;かた、-がた、かたち、なり;ち;shape, form, style;幵: put together<br>彡: three, hair ornament, short hair or fur radical (no. 59);彡;さん・さんづくり;(none);会意 Compound Ideographic;shape;Everyone in the kindergarten came up with fun and interesting shapes made out of Play-Doh, except for the kid with the amputated arm. Seems like you really need both hands.;With your two hands, outline the shape of a curvaceous woman. Is that a universally understood gesture? [Careful: mould (#680) which has two hands and soil/clay].
太;タイ、タ;ふと.い、ふと.る;おお, たか, ひろ;plump, fat, thick, big around;大: large, big<br>丶: dot, tick or dot radical (no. 3);大;だい・おおきい;(none);形声 Phonetic;plump;A large person with a big drop of sweat dripping off of him because he is so plump.;"Fat(""plump"") men always have small penises.....the kanji is a combination of ""large"" with a drop(representing the small penis between his legs)."
細;サイ;ほそ.い、ほそ.る、こま.か、こま.かい;;dainty, get thin, taper, slender, narrow;糸: thread<br>田: rice field, rice paddy;糸;いと・いとへん;(none);形声 Phonetic;dainty;Dainty women would always rather work with thread than in a field.;Spider-Man used to just be a dainty, brainy nerd.
広;コウ;ひろ.い、ひろ.まる、ひろ.める、ひろ.がる、ひろ.げる;;wide, broad, spacious;广: dotted cliff radical (no. 53)<br>厶: I, myself, katakana mu radical (no. 28);广;まだれ;廣;形声 Phonetic;wide;The Batcave is very wide and has a lot of elbow room for Batman to do his yoga.;"A wide cave has a lot of ""elbow room""."
長;チョウ;なが.い、おさ;お, おしゃ, たかし, たけ, な, は, ひさ;long, leader;長: long, grow, leader radical (no. 168);長;ながい;(none);象形 Pictographic;long;The Geisha with long hair uses an ornate lacquered hairpin to bundle it all up.;The top of this one reminds me of the staple primitive. So here´s my story: The girl´s hair was so long that she had to use staples instead of hairpins. It worked, but stapling her hair to her head was kinda painful.
点;テン;つ.ける、つ.く、た.てる、さ.す、とぼ.す、とも.す、ぼち;;spot, point, mark, speck, decimal point;占: fortune-telling, divining, forecasting, occupy, hold, have, get, take<br>火: fire;黑;くろ・くろへん;點;形声 Phonetic;spot;The FORTUNE TELLER was burned by FLAMES on the spot because she was accused of being a witch.;You have to stimulate the G-spot with your magic wand in order to get her on fire. Or you can juste use your mouth...
丸;ガン;まる、まる.める、まる.い;ま, わ, わに;round, full, month, perfection, -ship, pills, make round, roll up, curl up, seduce, explain away;九: nine<br>丶: dot, tick or dot radical (no. 3);丶;てん・ちょぼ・ちゅ・ちゅてん;(none);象形 Pictographic;round;Nine plus a drop rounds it off to ten!;"Watch out for plump (#120). Here Heisig could have added a ""t"" and we would have had a much better keyword : rotund. Rotund is more specific than ""round"" which begs for confusion with circle (#1811). A dictionary search on ""fat"" or ""round"" doesn´t yield this kanji, but ""rotund"" does! Primitive suggestion: the Laughing Buddha is often depicted as a rotund, smiling bald man in robes with a largely exposed pot belly stomach (symbolizing plenitude)."
交;コウ;まじ.わる、まじ.える、ま.じる、まじ.る、ま.ざる、ま.ぜる、-か.う、か.わす、かわ.す、こもごも;かた;mingle, mixing, association, coming & going;亠: kettle lid radical (no. 8)<br>父: father;亠;けいさん・けいさんかんむり・なべぶた;(none);象形 Pictographic;mingle;Even though your FATHER is an old man, he can´t give up his party lifestyle. Once a week he still dons his cool TOP HAT (well, it was cool 40 years ago) and goes out on the town to MINGLE with the ladies. This is a pretty common thing in Japan, where old motherfuckers still think they can pick up 19 year old girls.;Darth Vader tries to mingle with his troops. He even weares one of the helmets of the stromtroopers. (one of them laughs: white helmet, black suit. Darth Vader thereby slashes him in 2).
光;コウ;ひか.る、ひかり;あき, あきら, こお, てる, ひこ, み, みつ;ray, light;小: little, small<br>兀: high & level, lofty, bald, dangerous;儿;にんにょう・ひとあし;(none);会意 Compound Ideographic;ray;A ray of light is not a wave but made of little photons with human legs.;The ray from Honey I Shrunk the Kids made people little - ha! look at them run around on their tiny legs!
角;カク;かど、つの;い, す, すみ, ずみ, ふさ;angle, corner, square;勹: wrapping enclosure, wrapping radical (no. 20);角;つの・かく・つのへん;(none);象形 Pictographic;angle;A museum display of two walking sticks bound together under a glass canopy, showing the first device used to measure an angle.;The gates have been bound up together leaving no angle to get through...
計;ケイ;はか.る、はか.らう;え, かず, け;plot, plan, scheme, measure;言: say<br>十: ten;言;こと・げん・ごんべん・ことば;(none);会意 Compound Ideographic;plot;A plot is a summary of a book that can be given in ten words.;Say-ten´s (satan´s) evil plot.
直;チョク、ジキ、ジカ;ただ.ちに、なお.す、-なお.す、なお.る、なお.き、す.ぐ;すぐ, なお, のう, のお;straightaway, honesty, frankness, fix, repair;十: ten<br>目: eye, class, look, insight, experience, care, favor;目;め・めへん・よこめ;(none);会意 Compound Ideographic;straightaway;If you get a needle in your eye that is hooked in there, get to a hospital straightaway.;I caught a freaky creature with ten eyes on my fish hook, so I threw it back straightaway.
線;セン;すじ;;line, track;糸: thread<br>泉: spring, fountain;糸;いと・いとへん;(none);形声 Phonetic;line;This kanji is used for train lines. Spiderman does a hot spring tour of Japan using the train lines. You can see the Spidey costume hanging on the washing line as he enjoys the onsen.;Japan´s train lines are like threads that spring from Tokyo station.
矢;シ;や;;dart, arrow;天: heavens, sky, imperial;矢;や・やへん;(none);象形 Pictographic;dart;Zeus ran out of lightning bolts and has to drop darts from the heavens.;Do not mistake with LOSE 失.
弱;ジャク;よわ.い、よわ.る、よわ.まる、よわ.める;;weak, frail;弓: bow, bow (archery, violin)<br>冫: two-stroke water radical or ice radical (no. 15)<br>弓: bow, bow (archery, violin)<br>冫: two-stroke water radical or ice radical (no. 15);弓;ゆみ・ゆみへん;(none);会意 Compound Ideographic;weak;Two weak archers agree on a duel to the death. They constantly shoot at each other but never manage to hit their target. But what they lack in skill they make up in determination, and they keep shooting for hours, and days, and months, until it´s wintertime and their bows are coated in ice.;BOWS with ICE on them are brittle and WEAK.
強;キョウ、ゴウ;つよ.い、つよ.まる、つよ.める、し.いる、こわ.い;すね;strong;弓: bow, bow (archery, violin)<br>厶: I, myself, katakana mu radical (no. 28)<br>虫: insect, bug, temper;弓;ゆみ・ゆみへん;(none);会意 Compound Ideographic;strong;An insect who can fly vast distances is strong.;Legolas is so strong that he can even shoot down vast numbers of tiny insects at vast distances with ease.
高;コウ;たか.い、たか、-だか、たか.まる、たか.める;か, こ, じょい, た, はか;tall, high, expensive;亠: kettle lid radical (no. 8)<br>口: mouth<br>冂: upside-down box radical (no. 13)<br>口: mouth;高;たかい;(none);会意 Compound Ideographic;tall;Two little aliens in a trenchcoat and top hat, trying to look TALL. The bottom one, in the glass helmet, is under the coat. The top one has his top hat pulled down in disguise, so all you can see is his mouth.;Here we have TWO MOUTHS each wearing a different hat. The top one is wearing a TOP HAT which is know to be as a TALL hat. The bottom one is wearing a SPACE HELMET which is known as an EXPENSIVE hat. (this kanji means both).
同;ドウ;おな.じ;;same, agree, equal;冂: upside-down box radical (no. 13)<br>一: one, one radical (no.1)<br>口: mouth;口;くち・くちへん;(none);会意 Compound Ideographic;same;Muslim women wearing veils (HOOD) all look the same, you can just see ONE MOUTH and very little else.;Imagine monks wandering around the monastery. Covered in their hoods and chanting as if with one mouth they all look the same !
親;シン;おや、おや-、した.しい、した.しむ;ぎ, ちか, のり;parent, intimacy, relative, familiarity, dealer (cards);立: stand up, rise, set up, erect<br>木: tree, wood<br>見: see, hopes, chances, idea, opinion, look at, visible;見;みる;(none);会意 Compound Ideographic;parent;"A wise parent lets their kids learn. A kid wants to try to eat the red pepper plant, the wise parent says ""Try it and see for yourself"".";I remember this one the way the Japanese do: a parent standing on top of a tree watching what his or her kid is doing.
母;ボ;はは、も;;mama, mother;毋: do not, must not, be not, mother radical (no. 80);毋;なし・なかれ ・ははのかん;(none);象形 Pictographic;mama;The two breasts of a momma who breastfeeds.;This mama had twins, one mouth for each nipple.
父;フ;ちち;;father;父: father, father radical (no. 88);父;ちち;(none);会意 Compound Ideographic;father;Luke, I am your father. Darth Vader (really surprised nobody put this one up before: 2 laserswords).;Not to confuse anyone, but I think if you put your mind to it, you can see the image of a father here. The first two strokes take on the form of his eye brows, and the third and fourth stroke make up the nose and mustache.
姉;シ;あね、はは;;elder sister;女: woman, female<br>市: market, city, town;女;おんな・おんなへん;(none);形声 Phonetic;elder sister;Unlike the younger sister (妹), who is not yet old enough to date... the elder sister is on the market!;She´s old enough to be allowed to go to the market.
兄;ケイ、キョウ;あに;え, せ, よし;elder brother, big brother;口: mouth<br>八: eight, eight radical (no. 12);儿;にんにょう・ひとあし;(none);会意 Compound Ideographic;elder brother;My elder brother was basically a mouth on legs when he was a teenager.;Mother, why is elder brother´s mouth between the neighbor girl´s legs?
弟;テイ、ダイ、デ;おとうと;て;younger brother, faitherful service to elders;八: eight, eight radical (no. 12)<br>弔: condolences, mourning, funeral<br>丿: katakana no radical (no. 4);弓;ゆみ・ゆみへん;(none);象形 Pictographic;younger brother;Younger brothers are always more prone to mischief. Mine, you can almost see the little horns on him and the dollar signs on his eyes when he comes up with a money-making scheme.;The younger brother was a horny dollar -chasing bastard.
妹;マイ;いもうと;す, せ, も;younger sister;女: woman, female<br>未: un-, not yet, hitherto, still, even now, sign of the ram, 1-3PM, eighth sign of Chinese zodiac;女;おんな・おんなへん;(none);形声 Phonetic;younger sister;My younger sister is NOT YET a fully grown WOMAN.;Is your younger sister a woman? Not yet! Damn!
自;ジ、シ;みずか.ら、おの.ずから、おの.ずと;より;oneself;目: eye, class, look, insight, experience, care, favor;自;みずから;(none);象形 Pictographic;oneself;Faced with his clone, our hero valiantly cut a mark on his forehead right above his eye so that his comrades could tell his true oneself from the enemy.;To use an eyedropper by oneself, aim from above to put a drop into the eye.
友;ユウ;とも;う, ど, ゆ;friend;又: or again, furthermore, on the other hand;又;また;(none);会意 Compound Ideographic;friend;A good friend is always at your side. ---- I teach at a Japanese High School, and I often see chummy male students grabbing each other´s crotches in a joking manner. It´s still weird to me, but apparently reaching to your side and grabbing you neighbor´s crotch is a great way to express friendship.;Think of a sex friend (a fuck buddy if you will). The benefit of such a relationship is that there will always be a crotch by your side. (the Japanese refer to such a friend as セフレ, just as we do).
体;タイ、テイ;からだ、かたち;なり;body, substance, object, reality, counter for images;人: person<br>本: book, present, main, origin, true, real, counter for long cylindrical things;骨;ほね・ほねへん;體;形声 Phonetic;body;Mister T works out his body (body-building), using two piles of books (i.e. an exercise that can be done at home with two chairs, similar to push-ups but working mostly the shoulders, trapezius and triceps).;Mr. T works out his body then rips a book apart to test is body. His favorite to destroy is Dianetics.
毛;モウ;け;めん, も;fur, hair, feather, down;毛: fur, hair, fur radical (no. 82);毛;け;(none);象形 Pictographic;fur;I´ve heard of people having hair on the back of their hands, but this is ridiculous! That´s not hair, that´s fur!;Be careful not to pet a cat the wrong way - most cats don´t like you rubbing your hand backwards over their fur.
頭;トウ、ズ、ト;あたま、かしら、-がしら、かぶり;かみ, がみ, ちゃん, つむり, づ;head, counter for large animals;豆: beans, pea, midget<br>頁: page, leaf;頁;おおがい・いちのかい;(none);形声 Phonetic;head;The head of the family sits at the head of the table.;Mr Bean´s head.
顔;ガン;かお;;face, expression;彦: lad, boy (ancient)<br>頁: page, leaf;頁;おおがい・いちのかい;(none);形声 Phonetic;face;A lad's head still has a baby's face.;When I was a lad, a pretty face was all it took for someone to get in my head, and I´d fill pages of lovelorn letters to them.
首;シュ;くび;おびと, こべ, す;neck;自: oneself;首;くび;(none);象形 Pictographic;neck;The V shape is your neck on top of your collar bone, or the straight line. Yourself, or the rest of your body is below that!;The mooses neck supports it´s big horns and long nose.
心;シン;こころ、-ごころ;;heart, mind, spirit;心: heart, heart radical (no. 61);心;こころ・したごころ・りっしんべん;(none);象形 Pictographic;heart;"The four chambers in the heart. In the West, we point to our head when asked about the mind. In the East, they point to the heart. So then, the radical for ""state of mind""…";Heart needs three drops of blood to work.
時;ジ;とき、-どき;と, とぎ;time, hour;日: day, sun, Japan, counter for days<br>寺: Buddhist temple;日;ひ・ひへん・にち・にちへん;(none);形声 Phonetic;time;When the SUN starts to shine on the TEMPLE, it´s time to get up.;In ancient Japan, TIME of ´´day´´ was announced at the ´´buddhist temples´´. They did this by ringing large iron bells. This is similar to churches who ring their bells to announce the time of day.
曜;ヨウ;;てる;weekday;日: day, sun, Japan, counter for days<br>羽: feathers, counter for birds, rabbits<br>隹: bird, old bird radical (no. 172);日;ひ・ひへん・にち・にちへん;(none);形声 Phonetic;weekday;"Tip: feathers + turkey : This combination of primitives appears six times in Heisig, so it´s worthwhile giving it a name. I suggest ""futon"" (your futon is made from turkey feathers). REF: weekday (FRAME 576) , laundry (#577), leap (#1285), outstanding (#2272), twinkle (#2534), shimmering (#2880). Story: On weekdays you hang your futon out in the sun.";The poor farmer spends every weekday while the sun shines, plucking turkey feathers.
